slug,title,price,image_url,affiliate_link,category,keywords,pros,cons,description
one-beat-cordless-extension-board,One Beat Cordless Extension Board: Tangle-Free Power for Your Indian Home,499,https://m.media-amazon.com/images/I/5116mP4aFKL._SL1080_.jpg,https://amzn.to/49nxS4m,Tech,"cordless extension board, one beat power strip, portable power socket, rechargeable extension cord, wireless extension board india, travel extension board",Completely wireless and portable design; Eliminates cable clutter for a clean setup; Multiple sockets for charging several devices; Ideal for travel and areas with limited wall outlets,Requires periodic recharging of its internal battery; Not suitable for high-power appliances like heaters or irons; Limited battery capacity for extended use,"Say goodbye to the frustrating mess of tangled wires with the One Beat Cordless Extension Board. This innovative device is the perfect solution for modern Indian homes and offices, providing multiple power sockets without being tethered to a wall. Enjoy the freedom to power your laptops, charge your mobiles, and run your gadgets anywhere, from your living room sofa to your office desk, creating a clean and decluttered space.

Designed for ultimate convenience, this portable power strip is compact and lightweight, making it an essential accessory for travel or work-from-home setups. With built-in safety features like surge protection and a robust rechargeable battery, it ensures your precious devices are always juiced up safely. It's the ultimate upgrade for anyone tired of searching for the nearest plug point."
chakaachak-eco-spin-bucket-mop,Chakaachak ECO Spin Bucket Mop for Effortless Floor Cleaning,559,https://m.media-amazon.com/images/I/71M4ag-XxgL._SL1500_.jpg,https://amzn.to/43uBCx9,Home Appliances,"spin mop, bucket mop, floor cleaning mop, chakaachak mop, pocha for floor, magic mop india, home cleaning",Hands-free wringing with easy-to-use spin mechanism; 360-degree rotating head for cleaning under furniture and in corners; Super-absorbent microfibre mop head for a streak-free shine; Lightweight and durable bucket design,"Plastic bucket can be bulky for storage in small apartments; Spinner mechanism may wear out with rough, long-term use; Brand-specific mop head refills might be required","Say goodbye to the back-breaking jhanjhat of traditional mopping with the Chakaachak ECO Spin Bucket Mop. Designed for modern Indian homes, this system makes floor cleaning quick, hygienic, and incredibly easy. The innovative spin bucket lets you control the mop's dampness with a simple push, wringing out dirty water without you ever having to touch it.

Featuring a 360-degree rotating head and a super-absorbent microfibre cloth, this mop glides effortlessly across all hard floors, including tiles, marble, and laminate. It easily picks up dust, dirt, and spills, reaching under furniture and into tight corners to leave your home sparkling clean, or as we say, completely 'Chakaachak'!"
apple-iphone-17-pro-256-gb,Apple iPhone 17 Pro (256 GB) - The Future in Your Pocket,134900,https://m.media-amazon.com/images/I/618vU2qKXQL._SL1500_.jpg,https://amzn.to/3M3qscE,Tech,"iphone 17 pro price in india, apple iphone 17 pro, latest iphone, 256 gb smartphone, best camera phone, buy iphone online",Blazing-fast performance with the new A20 Bionic chip; Truly immersive edge-to-edge display with under-screen camera; Next-generation camera system for professional-grade photos and videos; Excellent all-day battery life,"Premium price point, making it a significant investment; Portless design may require new wireless accessories; Incremental software features at launch","Unleash the power of tomorrow with the Apple iPhone 17 Pro. Engineered with the revolutionary A20 Bionic chip, this device delivers mind-blowing speed for everything from high-end gaming to professional video editing. Its stunning new design features an uninterrupted, edge-to-edge ProMotion display, thanks to a groundbreaking under-screen front camera, offering an immersive viewing experience like never before.

Capture life's moments in breathtaking detail with the advanced pro camera system, now enhanced with AI-powered cinematic stabilization and low-light fusion technology. With a generous 256 GB of storage, you'll have ample space for all your 8K videos, high-resolution photos, and essential apps. The all-day battery life and faster MagSafe charging ensure you're always connected, making the iPhone 17 Pro the ultimate tool for creators and professionals across India."
nilkamal-freedom-big-fmm-plastic-cabinet,Nilkamal Freedom Big FMM Plastic Cabinet for Home & Office Storage,4590,https://m.media-amazon.com/images/I/61oxcYAz6oL._SL1200_.jpg,https://amzn.to/3JNaRxj,Kitchen,"nilkamal plastic cabinet, storage cabinet india, plastic almirah, cupboard for clothes, nilkamal freedom cabinet, home storage solutions","Spacious multi-shelf design for ample storage; Durable, termite-proof, and rust-resistant plastic body; Lightweight, easy to assemble, and portable; Low maintenance and simple to clean",Plastic build may not suit all home decor styles; Not ideal for storing extremely heavy items; Shelves are fixed and not adjustable,"Tired of clutter? Bring home the Nilkamal Freedom Big (FMM) Plastic Cabinet and reclaim your space! This versatile storage solution is perfect for the modern Indian household, offering ample room with multiple shelves to neatly organize everything from clothes and books to toys and files. Its sturdy and compact design makes it an ideal fit for any room, be it your bedroom, kids' room, or even the office.

Crafted from high-quality, durable plastic, this cabinet is built to last. Say goodbye to worries about termites, rust, or corrosion, which are common issues with wooden or metal furniture. The lightweight construction makes it incredibly easy to assemble and move around, while the smooth surface ensures hassle-free cleaning. It's the practical, low-maintenance storage almirah you've been looking for."
honeywell-air-purifier-for-home,Honeywell Air Purifier for Home: Breathe Clean Air in India,11998,https://m.media-amazon.com/images/I/618awOMfz0L._SL1500_.jpg,https://amzn.to/4pd3iyQ,Home Appliances,"honeywell air purifier, air purifier india, best air purifier for home, air purifier for pollution, hepa filter air purifier, air purifier for dust, pm2.5 air purifier","High-efficiency HEPA filter effectively removes PM2.5 and allergens; Excellent CADR for quick air purification in medium to large rooms; Trusted brand with reliable performance and build quality; Quiet operation, making it suitable for bedrooms and offices",Cost of periodic filter replacement can add up; Some models may lack smart features like Wi-Fi connectivity; Design can be bulky for very small spaces,"Combat the rising dust, pollution, and allergens in Indian cities with the powerful Honeywell Air Purifier. Equipped with an advanced HEPA filter and an activated carbon layer, this appliance captures up to 99.97% of airborne pollutants, including PM2.5 particles, dust mites, pet dander, and harmful gases, ensuring your family breathes only the purest air.

Designed for modern Indian homes, the Honeywell purifier offers a high Clean Air Delivery Rate (CADR) to quickly circulate clean air in your bedroom or living room. Its user-friendly interface, quiet operation, and filter change indicators make it a hassle-free addition to your home, promoting better sleep, reducing allergy symptoms, and creating a healthier indoor environment for everyone."
crompton-arno-neo-15l-5-star-storage-water-heater-geyser,Crompton Arno Neo 15-L 5-Star Rated Storage Water Heater (Geyser),5999,https://m.media-amazon.com/images/I/515nNlnjmSL._SL1100_.jpg,https://amzn.to/3LJJvIY,Home Appliances,"crompton geyser 15 litre, 5 star water heater, storage geyser, crompton arno neo, best geyser india, water heater for bathroom",Excellent 5-star energy rating for lower electricity bills; Advanced 3-level safety for complete user protection; Powerful copper heating element for fast water heating; Sleek and rust-proof body suitable for modern bathrooms,15-litre capacity may be insufficient for large families; Installation and pipes are typically not included in the box; Lacks a digital temperature display,"Say goodbye to chilly mornings with the Crompton Arno Neo 15-L Storage Water Heater. This geyser is designed for the modern Indian home, offering quick and consistent hot water whenever you need it. With its impressive BEE 5-star rating, it's incredibly energy-efficient, helping you save significantly on your monthly electricity bills while enjoying the comfort of a warm shower.

Safety and durability are paramount, and the Arno Neo delivers. It features advanced 3-level safety protection against electric shocks and overheating, ensuring complete peace of mind for your family. The powerful copper heating element ensures fast heating, and its sleek, compact design fits perfectly in any contemporary bathroom, making it a reliable and stylish addition to your home."
godrej-8kg-5-star-ai-top-load-washing-machine-with-heater,Godrej 8 Kg 5 Star AI Powered Fully Automatic Top Load Washing Machine with Heater,18790,https://m.media-amazon.com/images/I/71tJq3lWo8L._SL1500_.jpg,https://amzn.to/3JAFndO,Home Appliances,"godrej washing machine, fully automatic top load, 8kg washing machine, washing machine with heater, 5 star washing machine, low water pressure washing machine, best washing machine india",Inbuilt heater for superior stain removal and hygiene; Fills tub even at very low water pressure; 5-Star energy rating for maximum electricity savings; AI-powered sensors for an optimized and efficient wash,Higher water consumption compared to front-load models; Premium price point due to advanced features,"Upgrade your laundry routine with the Godrej 8 Kg Fully Automatic Washing Machine, a perfect solution for Indian households. Its powerful inbuilt heater tackles tough stains like oil and masala with ease, ensuring a hygienic and deep clean for your clothes. The 5-star energy rating means significant savings on your electricity bills, making it both powerful and economical.

What truly sets this machine apart is its ability to function even at near-zero water pressure, a common issue in many Indian cities. The AI-powered sensors automatically detect the load and select the optimal wash settings, saving water, detergent, and time. With its generous 8 kg capacity, it's the ideal choice for families of 4-5 members, handling daily wear and heavy linens effortlessly."
temtop-indoor-air-quality-monitor-temperature-humidity,Temtop Indoor Air Quality Monitor with Temperature & Humidity Sensor,6600,https://m.media-amazon.com/images/I/61anCQLll-L._SL1500_.jpg,https://amzn.to/3JDsqjr,Home Appliances,"air quality monitor india, indoor air quality, temtop monitor, temperature humidity meter, home air pollution, pm2.5 meter, air quality sensor","Monitors multiple air quality factors beyond just temperature and humidity.; Large, easy-to-read screen for quick data checks.; Compact and portable design with a rechargeable battery.; Helps you take action to improve your home's air quality.",Sensor accuracy may not be on par with professional-grade equipment.; Continuous monitoring can lead to shorter battery life between charges.; May lack advanced features like Wi-Fi connectivity or a smartphone app.,"In today's world, especially in Indian cities, knowing the quality of the air you breathe indoors is crucial for your family's health. The Temtop Indoor Air Quality Monitor goes beyond a basic thermometer, providing a comprehensive overview of your home environment by tracking not just temperature and humidity, but also other key air quality indicators, empowering you to create a safer, healthier living space.

Featuring a large, crystal-clear display, this device allows you to check your air quality at a single glance. Its sleek, portable design and built-in rechargeable battery mean you can easily place it in any room, from the bedroom to the living room. For any health-conscious household in India, this monitor is an essential tool to ensure your family is breathing clean, healthy air."
aptechdeals-digital-hygrometer-thermometer-with-clock,ApTechDeals Digital Hygrometer Thermometer With Clock & Large LCD Display,329,https://m.media-amazon.com/images/I/51H83c1KeKL._SL1000_.jpg,https://amzn.to/48nah1F,Home Appliances,"digital hygrometer india, room thermometer, humidity meter for home, indoor temperature monitor, digital clock with temperature, weather station clock, aptechdeals","Multifunctional 3-in-1 device (Temperature, Humidity, Clock); Large, clear LCD display for easy reading at a glance; Versatile placement options with tabletop stand and wall mount; Helps maintain a healthy and comfortable indoor environment",Requires batteries which may not be included; Lacks a backlight for viewing in the dark; Basic functionality with no smart features or app connectivity,"Keep your home's environment perfectly comfortable with the ApTechDeals Digital Hygrometer and Thermometer. This handy 3-in-1 device accurately displays the current temperature, humidity levels, and time on a large, easy-to-read LCD screen. Whether you're concerned about the monsoon humidity or the dry winter air, this meter helps you monitor your indoor climate to ensure a healthier living space for your family.

Designed for convenience, it features a built-in stand for any tabletop and a slot for wall mounting, making it perfect for your bedroom, living room, baby's room, or office. It also includes a daily alarm clock function, making it a versatile and essential gadget for any modern Indian household. Stay informed and in control of your indoor comfort with this affordable and reliable device."