slug,title,price,image_url,affiliate_link,category,keywords,pros,cons,description
amazon-echo-4th-gen-smart-speaker,Amazon Echo (4th Gen) | Premium Smart Speaker with Dolby Audio & Alexa,"9,999",https://m.media-amazon.com/images/I/61HKV+aDE4L._SL1000_.jpg,https://www.amazon.in/gp/product/B085FWR7T4/ref=ewc_pr_img_2?smid=AJ6SIZC8YQDZX&th=1,Tech,"amazon echo 4th gen, alexa speaker india, smart speaker, dolby audio speaker, smart home hub, bluetooth speaker","Excellent sound quality with Dolby Audio; Built-in Zigbee smart home hub for easy setup; Sleek, modern spherical design; Responsive Alexa with Hindi language support",Larger footprint than the Echo Dot; Requires a constant power supply; Higher price point compared to smaller smart speakers,"Upgrade your home audio and smart living experience with the Amazon Echo (4th Gen). Its new spherical design isn't just for looks; it delivers crisp highs, dynamic mids, and deep bass for rich, detailed sound that adapts to any room. With premium Dolby audio, your favourite Bollywood hits, podcasts, and audiobooks will sound better than ever. Just ask Alexa in English or Hindi to play music, answer questions, set alarms, or get the latest cricket scores.

The Echo (4th Gen) is more than just a speaker—it's the heart of your smart home. It features a built-in Zigbee smart home hub, allowing you to effortlessly set up and control compatible lights, plugs, and sensors without needing a separate hub. Group multiple Echo devices for a synchronized multi-room music experience, making it the perfect central command for your connected home in India."
lumio-arc-5-projector,Lumio Arc 5 Smart Android Projector | Full HD 1080p with 4K Support,"18,499",https://m.media-amazon.com/images/I/719ChY6aQ6L._SL1500_.jpg,https://amzn.to/4nVmrEk,Tech,"lumio arc 5, home projector india, full hd projector, smart android projector, portable projector, projector for home theatre",Bright Full HD 1080p native resolution; Built-in Android OS with pre-installed apps; Compact and portable design; Auto-keystone for easy picture alignment,Built-in speaker has average sound quality; Fan noise can be noticeable in quiet scenes; Not bright enough for daytime use in sunny rooms,"Bring the magic of the big screen to your home with the Lumio Arc 5 Smart Projector. This device delivers a stunning, crystal-clear Full HD 1080p picture, perfect for watching the latest Bollywood blockbusters, gripping web series, or live cricket matches on a massive screen. Its high brightness ensures a vibrant and vivid image, transforming any wall into an instant home theatre.

Powered by a built-in Android OS, the Arc 5 gives you instant access to your favourite streaming apps like Netflix, Hotstar, and YouTube without needing any extra devices. Its compact, lightweight design and automatic keystone correction make setup incredibly easy, allowing you to create an immersive entertainment experience anywhere, from your living room to your backyard."
honeywell-air-purifier-for-home-and-office,Honeywell Air Purifier for Home & Office | Breathe Clean Air in India,"5,149",https://m.media-amazon.com/images/I/71ipnrfS-1L._SL1500_.jpg,https://amzn.to/3WUoOfR,Home Appliances,"honeywell air purifier, air purifier india, hepa filter air purifier, home air purifier, air purifier for pollution, pm2.5 filter, delhi air quality",High-efficiency HEPA filter captures 99.97% of pollutants; Excellent CADR for medium to large Indian rooms; Trusted brand with reliable after-sales service in India; Real-time air quality display and auto mode,Filter replacement can be a recurring expense; Initial cost may be higher than some local brands,"Combat the rising air pollution in Indian cities and protect your family with the Honeywell Air Purifier. Equipped with an advanced HEPA filter and an activated carbon filter, it effectively removes up to 99.97% of airborne pollutants, including dust, pet dander, pollen, smoke, and harmful PM2.5 particles. Create a safe and healthy breathing environment inside your home or office, ensuring peace of mind for you and your loved ones.

Designed for modern Indian living spaces, this purifier offers a high Clean Air Delivery Rate (CADR) suitable for bedrooms, living rooms, and office cabins. Its user-friendly interface, real-time air quality indicator, and whisper-quiet operation make it a seamless addition to your daily life. Invest in your health and experience the difference of breathing truly clean, fresh air every day."
amazon-basics-electric-egg-boiler,Amazon Basics Electric Egg Boiler: Perfect Eggs Every Time,459,https://m.media-amazon.com/images/I/71tIWqrBr6L._SL1500_.jpg,https://amzn.to/48lL8V5,Kitchen,"electric egg boiler, egg cooker india, amazon basics egg boiler, best egg boiler, anda ubalne ki machine, kitchen appliances","Cooks eggs perfectly to soft, medium, or hard consistency; Extremely easy to use with one-touch operation; Auto-shut off feature for safety and convenience; Compact design, easy to clean and store",The buzzer sound is quite loud; The plastic body might feel less durable than steel alternatives; Limited to boiling a maximum of 7 eggs at a time,"Say goodbye to the guesswork of boiling eggs on the stove! The Amazon Basics Electric Egg Boiler makes getting perfectly cooked eggs for your breakfast or meals completely effortless. Whether you like them soft, medium, or hard-boiled, this handy appliance delivers consistent results every single time with just the touch of a button, saving you time and effort on busy mornings.

Designed for convenience, this compact egg boiler can cook up to 7 eggs at once. It comes with a measuring cup to add the perfect amount of water for your desired doneness, and a piercing pin to prevent shells from cracking. The auto-shut off feature with a buzzer ensures your eggs are never overcooked and provides added safety. It's the perfect addition to any modern Indian kitchen, especially for students, working professionals, and small families."
orient-electric-areva-portable-room-heater,Orient Electric Areva 2000W Portable Fan Room Heater,"1,399",https://m.media-amazon.com/images/I/71QfC+NELFL._SL1500_.jpg,https://amzn.to/4r2ln4o,Home Appliances,"room heater india, orient room heater, portable fan heater, 2000w room heater, heater for winter, orient areva, best budget room heater","Compact, lightweight, and easily portable; Two heat settings (1000W/2000W) for flexible usage; Provides quick heating for immediate warmth; Equipped with essential safety features like thermal cut-out",The fan can be noisy during operation; May reduce humidity and dry out the air in the room; Not ideal for heating very large spaces,"Say goodbye to the biting winter chill with the Orient Electric Areva Portable Room Heater. This compact and powerful fan heater is your perfect companion for staying warm and cozy, whether you're in your bedroom, study, or office. Its powerful 2000W heating element and fan ensure quick and efficient heat distribution, turning any small to medium-sized room into a comfortable haven in minutes.

Designed with both convenience and safety in mind, the Areva heater features two distinct heating modes (1000W and 2000W) and an adjustable thermostat to maintain your desired temperature. The durable ABS plastic body and built-in safety features like a thermal cut-out provide complete peace of mind, making it a reliable and essential home appliance for every Indian household during the cold season."
kent-digi-plus-air-fryer,"KENT Digi Plus Air Fryer for Healthy, Oil-Free Cooking","3,249",https://m.media-amazon.com/images/I/51aQUeYhK1L._SL1080_.jpg,https://amzn.to/43vxLQm,Kitchen,"kent air fryer, digital air fryer, oil free fryer india, healthy cooking appliance, air fryer for home, kitchen appliances","Digital touch panel with 8 pre-set menu options for easy cooking.; Cooks food with up to 80% less oil, ideal for health-conscious families.; Multi-functional: Can fry, grill, roast, bake, and defrost.; Easy to clean components and compact design.",Cooking capacity may be limited for large gatherings.; Requires some counter space in the kitchen.; Initial learning curve to adjust cooking times from traditional methods.,"Enjoy your favourite Indian snacks like samosas, pakoras, and tikkis guilt-free with the KENT Digi Plus Air Fryer. This smart kitchen appliance uses Rapid Hot Air Technology to cook food with up to 80% less oil, making your meals healthier without compromising on taste or crispiness. Its intuitive digital touch panel and pre-set menus make cooking effortless for everyone in the family.

Beyond just frying, this versatile appliance can also grill, roast, bake, and even defrost, making it an all-in-one solution for your kitchen. With its convenient timer and adjustable temperature controls, you get perfect results every time. The KENT Digi Plus is designed for modern Indian homes, offering a quick, clean, and healthy way to prepare delicious dishes daily."
e-gate-atom-2x-smart-android-projector,E GATE Atom 2X Smart Android Projector for Home Cinema,"4,990",https://m.media-amazon.com/images/I/71FeN06o4nL._SL1500_.jpg,https://amzn.to/3WZICyp,Tech,"projector for home india, e gate projector, smart android projector, full hd projector, home cinema projector, atom 2x projector, budget projector","Built-in Android OS with pre-installed OTT apps; Bright and clear Full HD 1080p native resolution; Multiple connectivity options (Wi-Fi, Bluetooth, HDMI); Excellent value for a smart projector in India",Built-in speaker quality is average; external speakers recommended; Best performance is in a dark or dimly lit room; Lacks advanced auto-focus and keystone features,"Transform your living room into a spectacular home theatre with the E GATE Atom 2X Smart Android Projector. This device brings the magic of the big screen right to your home, offering a stunning Full HD 1080p native resolution for crisp and vibrant visuals. With its built-in Android OS, you can directly stream your favorite movies and shows from popular apps like Netflix, Prime Video, and YouTube without needing any extra devices.

Setting up your personal cinema has never been easier. The Atom 2X boasts multiple connectivity options including Wi-Fi, Bluetooth, HDMI, and USB, making it compatible with everything from your laptop to your gaming console. Its compact design and powerful performance make it the perfect value-for-money choice for Indian families looking to upgrade their entertainment experience."
lg-185l-5-star-smart-inverter-refrigerator,LG 185L 5 Star Inverter Direct-Cool Single Door Refrigerator,"16,990",https://m.media-amazon.com/images/I/615WqNen-1L._SL1500_.jpg,https://amzn.to/4o16AV9,Home Appliances,"lg refrigerator, 5 star refrigerator, single door fridge, 185l refrigerator, lg fridge india, inverter compressor fridge, best budget refrigerator","Excellent 5-star energy rating for maximum electricity savings.; Smart Inverter Compressor offers silent operation and long-lasting durability.; Stabilizer-free operation protects against voltage fluctuations.; Compact and ideal for small families, bachelors, or as a secondary fridge.",Limited 185L capacity is not suitable for larger families.; Requires manual defrosting as it is a Direct-Cool model.; Basic freezer section with limited space.,"Upgrade your kitchen with the LG 185L Single Door Refrigerator, a perfect blend of style and efficiency for the modern Indian home. Its impressive 5-star energy rating, powered by the Smart Inverter Compressor, ensures you save big on electricity bills every month without compromising on performance. This compact fridge is an ideal choice for bachelors, couples, or small families looking for a reliable and cost-effective cooling solution.

Designed for convenience, this LG refrigerator operates quietly and can handle power fluctuations with its stabilizer-free operation, a must-have for Indian households. The toughened glass shelves are built to withstand heavy utensils, while the fast ice-making feature gets you ready for guests in no time. It's a smart investment for anyone seeking durability, energy savings, and trusted LG performance in a sleek package."
sharp-92-l-2-star-mini-direct-cool-single-door-refrigerator,"SHARP 92 L 2 Star Mini Refrigerator (Direct Cool, Single Door)","10,490",https://m.media-amazon.com/images/I/612e8ZfxEEL._SL1500_.jpg,https://amzn.to/4r6Cxy6,Home Appliances,"mini refrigerator india, sharp refrigerator 92l, small fridge for room, bachelor fridge, direct cool refrigerator, single door fridge price",Compact size is perfect for small rooms and offices; Energy efficient with a 2-star rating for lower bills; Separate chiller compartment for ice and frozen items; Affordable and budget-friendly price point,Requires manual defrosting; Limited capacity not suitable for families; 2-star rating is less efficient than higher-rated models,"Discover the perfect cooling solution for compact spaces with the SHARP 92 L Mini Refrigerator. Ideal for bachelor pads, dorm rooms, or as a personal fridge in your office, its sleek single-door design fits effortlessly anywhere. The 92-litre capacity is surprisingly spacious, offering ample room for your beverages, snacks, and essentials, all while maintaining optimal freshness with its efficient direct cool technology.

Engineered for convenience and affordability, this mini fridge comes with a 2-star energy rating, ensuring your electricity bills stay low without compromising on performance. It features a separate chiller compartment for making ice quickly and adjustable shelves to customize your storage. For anyone in India seeking a reliable, space-saving, and budget-friendly refrigerator, this SHARP model is an excellent choice."
samsung-galaxy-m17-5g-sapphire-black-8gb-128gb,"Samsung Galaxy M17 5G (Sapphire Black, 8GB RAM, 128GB Storage) - Next-Gen Speed","15,499",https://m.media-amazon.com/images/I/71kmZ1zJYUL._SL1500_.jpg,https://amzn.to/4r6NyiU,Tech,"samsung galaxy m17 5g, samsung 5g phone, best 5g phone under 20000, 8gb ram phone, samsung india, latest samsung m series",Blazing-fast 5G connectivity; Ample 8GB RAM for seamless multitasking; Large 128GB internal storage; Long-lasting battery life,Plastic build quality typical for the M-series; May include pre-installed bloatware; Charger might not be included in the box,"Unleash the power of next-generation connectivity with the Samsung Galaxy M17 5G. Designed for the modern Indian user, this smartphone combines blazing-fast 5G speeds with a robust 8GB of RAM, ensuring silky-smooth multitasking whether you're gaming, streaming high-definition content, or switching between your favourite apps. The generous 128GB of internal storage provides ample space for all your photos, videos, and applications without ever slowing you down.

Wrapped in a stunning Sapphire Black finish, the Galaxy M17 5G is as stylish as it is powerful. Its immersive display brings your content to life, while the long-lasting battery keeps you powered throughout the day. Capture life's best moments with its versatile camera setup and enjoy a clean, user-friendly experience, making it the perfect all-rounder for work, play, and everything in between."
samsung-galaxy-f56-5g-violet-8gb-128gb,"Samsung Galaxy F56 5G (Violet, 8GB RAM, 128GB Storage)","23,900",https://m.media-amazon.com/images/I/515alPqzvkL._SL1000_.jpg,https://amzn.to/47H8LrV,Tech,"samsung galaxy f56 5g, samsung 5g phone, best mid-range phone india, 8gb ram smartphone, samsung f series, latest samsung phone",Blazing-fast 5G connectivity for instant downloads and streaming; Smooth multitasking and gaming with 8GB RAM; Vibrant display for an immersive viewing experience; Long-lasting battery life to get you through the day,Plastic body might feel less premium than competitors; Comes with some pre-installed bloatware; Low-light camera performance can be average,"Unleash next-generation speed and performance with the Samsung Galaxy F56 5G. Powered by 8GB of RAM and equipped with blazing-fast 5G connectivity, this smartphone is designed for seamless multitasking, lag-free gaming, and instant downloads. Store all your favorite photos, videos, and apps with ease on the generous 128GB of internal storage, and enjoy it all on a stunningly vibrant display that brings your content to life in the eye-catching Violet finish.

Capture your world in brilliant detail with the versatile camera system, perfect for everything from scenic landscapes to beautiful portraits. The massive all-day battery ensures you stay connected and entertained from morning to night without constantly searching for a charger. The Galaxy F56 5G is the perfect blend of style, power, and endurance, making it the ideal companion for the modern Indian user."
samsung-galaxy-m17-5g-moonlight-silver-8gb-128gb,"Samsung Galaxy M17 5G (Moonlight Silver, 8GB RAM, 128GB Storage) | Power-Packed Performance","15,499",https://m.media-amazon.com/images/I/71fOArIi24L._SL1500_.jpg,https://amzn.to/3WZJ1AV,Tech,"samsung galaxy m17 5g, 5g smartphone india, samsung m series, 8gb ram mobile phone, best budget 5g phone",Blazing-fast 5G connectivity; Smooth performance with 8GB RAM; Ample 128GB internal storage; Long-lasting battery life,Plastic body construction; Charger might be sold separately; Bloatware can be a concern,"Unleash the power of next-gen connectivity with the Samsung Galaxy M17 5G. Designed for the modern Indian user, this smartphone combines lightning-fast 5G speeds with a massive 8GB of RAM, ensuring silky-smooth multitasking and a lag-free gaming experience. The generous 128GB of internal storage gives you ample space for all your apps, photos, and videos, all wrapped in a stunning Moonlight Silver finish.

Capture life's best moments with its versatile camera system and enjoy immersive content on the vibrant display. The Galaxy M17 5G is engineered with a long-lasting battery to keep you powered through your busiest days, making it the perfect all-rounder for work, play, and everything in between. It's a reliable and stylish choice for anyone looking to upgrade to a future-ready device without breaking the bank."
dell-15-intel-core-i5-13th-gen-1334u-laptop,Dell 15 Laptop with 13th Gen Intel Core i5-1334U Processor,"55,990",https://m.media-amazon.com/images/I/712WiT-wexL._SL1500_.jpg,https://amzn.to/47Xc6C5,Tech,"dell 15 laptop, intel core i5 13th gen, dell laptop india, best laptop for students, work from home laptop, dell 1334u, i5 laptop price",Powerful 13th Gen Intel Core i5 processor for smooth multitasking; Crisp Full HD anti-glare display for comfortable viewing; Lightweight design perfect for portability; Reliable performance for students and professionals,Integrated graphics not suitable for heavy gaming or video editing; Build quality is primarily plastic; Base models may have limited RAM,"Unleash your productivity with the new Dell 15 laptop, powered by the latest 13th Generation Intel Core i5-1334U processor. Designed for the modern Indian user, this machine effortlessly handles everyday tasks, from intense multitasking for work and studies to streaming your favourite Bollywood movies. Experience snappy performance and efficiency that keeps you ahead of your deadlines.

Featuring a vibrant Full HD display, every image and video comes to life with stunning clarity. Its sleek and lightweight design makes it easy to carry to the office, college, or your favourite café. With Dell's trusted reliability and a range of essential ports, the Dell 15 is the perfect all-round companion for your daily digital life, offering a seamless blend of power and portability."
apple-2024-macbook-pro-laptop-m4-chip,Apple 2024 MacBook Pro with M4 Chip: The Ultimate Powerhouse,"2,01,990",https://m.media-amazon.com/images/I/81FfGlHo+FL._SL1500_.jpg,https://amzn.to/4i1ZEFB,Tech,"macbook pro m4 india, apple laptop 2024, best laptop for creators, m4 chip laptop, apple macbook price, high-performance laptop","Groundbreaking M4 chip performance for pro apps; Best-in-class Liquid Retina XDR display; Exceptional battery life for all-day use; Premium, durable build quality",Premium price point for the Indian market; Limited port selection may require dongles; RAM and storage are not user-upgradable,"Experience a revolutionary leap in performance with the new Apple MacBook Pro, powered by the groundbreaking M4 chip. Designed for professionals and creators in India, this laptop crushes demanding tasks like 8K video editing, complex 3D rendering, and intensive coding with unprecedented speed and efficiency. Its next-generation Neural Engine makes AI-powered workflows faster than ever, turning your most ambitious ideas into reality.

The stunning Liquid Retina XDR display brings your content to life with vibrant colours and incredible detail, while the all-day battery life keeps you productive on the go. Encased in a sleek and durable aluminium body, the MacBook Pro with M4 is not just a tool, but an investment in peak performance and premium design, setting a new standard for professional laptops."
jiobook-11-android-4g-laptop-with-office,JioBook 11 (2023) - India's Ultra-Affordable 4G Laptop with Lifetime Office,"12,990",https://m.media-amazon.com/images/I/61IDcxw27+L._SL1000_.jpg,https://amzn.to/4oFj8Cq,Tech,"jiobook 11, 4g laptop india, budget laptop, student laptop, android laptop, jio laptop price","Built-in 4G LTE for always-on internet connectivity; Extremely budget-friendly and value for money; Includes a lifetime subscription to a cloud office suite; Lightweight, compact, and offers long battery life",Limited performance for demanding tasks like gaming or video editing; Android-based OS cannot run traditional Windows/Mac software; Basic screen resolution and build quality,"Stay connected and productive anywhere with the revolutionary JioBook 11, India's own 4G-enabled laptop. Designed for the modern Indian user, this device offers seamless internet access with its built-in Jio 4G LTE SIM, making it perfect for students, online learning, browsing, and on-the-go work without depending on Wi-Fi. Its lightweight design and long battery life ensure you can carry your world with you, hassle-free.

Powered by the intuitive JioOS based on Android, the JioBook provides a familiar, mobile-first experience on a larger screen. The biggest value-add is the included lifetime subscription to a cloud-based Office suite, allowing you to create documents, spreadsheets, and presentations right out of the box. For an incredibly budget-friendly price, the JioBook 11 is the ultimate entry-level laptop for every Indian household looking to get online and get things done."
be-bodywise-6-aha-bha-underarm-roll-on-deodorant,Be Bodywise 6% AHA BHA Underarm Roll On for Odour & Pigmentation,379,https://m.media-amazon.com/images/I/81SAWSdoamL._SL1500_.jpg,https://amzn.to/4i6vuRN,Home Appliances,"underarm roll on, deodorant for dark underarms, be bodywise india, aha bha deodorant, body odour control, pigmentation roll on, even tone underarms","Effectively reduces underarm pigmentation and dark spots.; Provides long-lasting odour control.; Gentle, alcohol-free formula suitable for sensitive skin.; Exfoliates to reveal smoother underarm skin.",May take several weeks of consistent use to see visible brightening.; Can cause a slight tingling sensation upon initial use.; The scent may be too subtle for those who prefer strong fragrances.,"Say goodbye to dark underarms and body odour with the Be Bodywise 6% AHA BHA Underarm Roll On. This innovative deodorant is specially formulated for the Indian climate, tackling two common concerns in one go. The powerful combination of Alpha Hydroxy Acid (AHA) and Beta Hydroxy Acid (BHA) gently exfoliates the skin, helping to reduce pigmentation and reveal brighter, smoother underarms over time.

More than just a deodorant, this roll-on provides long-lasting protection against sweat and odour, keeping you fresh and confident all day long. Its gentle, alcohol-free formula is designed to prevent irritation, making it suitable for regular use. Switch to this smart solution for even-toned underarms and worry-free freshness."
healthifyme-smart-scale,HealthifyMe Smart Scale: Your Complete Body Composition Analyzer,1199,https://m.media-amazon.com/images/I/61VNrxxDViL._SL1500_.jpg,https://amzn.to/43yLqGx,Tech,"smart scale india, healthifyme scale, body composition analyzer, bluetooth weighing scale, bmi scale, smart weighing machine, fitness tracker",Tracks 12+ detailed body composition metrics; Seamlessly syncs with the popular HealthifyMe app; Supports multiple user profiles for the entire family; High-precision sensors for reliable and accurate data,Full functionality requires the HealthifyMe app and a smartphone; Runs on non-rechargeable AAA batteries; Readings can be influenced by placement on uneven surfaces,"Go beyond just weight tracking with the HealthifyMe Smart Scale. This advanced device measures over 12 crucial body metrics, including BMI, body fat percentage, muscle mass, and hydration levels, giving you a holistic view of your health. By syncing seamlessly with the popular HealthifyMe app, it provides detailed insights and trends, making it easier than ever to understand your body and stay motivated on your fitness journey in India.

Designed for the modern Indian family, the scale supports multiple user profiles, automatically recognizing each member. Its sleek design and high-precision sensors ensure both accuracy and style, fitting perfectly into any home. Whether your goal is weight loss, muscle gain, or simply maintaining a healthy lifestyle, this smart scale is the perfect partner to help you achieve it with data-driven precision."
